vol	issue	month	year	file_name	country	region_en	region	region_local	latitude	longitude	country_db	caption_title	caption
91	2	Feb	1947	vol-91_no-02_Feb-1947_04.jpg	Siam	Bangkok	Bangkok		13.756	100.502	Thailand	No Plush Cushions Here; Passengers Have Observation Seats Even on the Roof	During the war Allied flyers heavily bombed Siamese railway bridges and rolling stock to halt movement of Japanese troops and supplies. When war ended, only a few local trains ran. Through service to the north has since been re-established.
91	2	Feb	1947	vol-91_no-02_Feb-1947_05.jpg	Cameroon				7.370	12.355	Cameroon	Six-foot Matakam Tribesmen March to Market under Firewood Parasols. Some Lack Goatskin Vests, but No One Worries	On the eroded Mandara Mountains, where their ancestors sought refuge from Moslem slave raiders, these people make their home under a benevolent French administration. Civilization's formal education and changing fashions are not their problems. A little road work fulfills their duty to the State. Farming and fishing provide a livelihood. In the highlands of the north Cameroons the Matakam enjoy a comfortable climate.
91	2	Feb	1947	vol-91_no-02_Feb-1947_06.jpg	Cameroon				7.370	12.355	Cameroon	Says His Wife: "I Should Wear Hot, Sticky Clothes!"	
91	2	Feb	1947	vol-91_no-02_Feb-1947_07.jpg	Cameroon				7.370	12.355	Cameroon	Gowned in Leaves, Ornamented with Scars, Stands a Girl on Brass-bound Legs	
91	2	Feb	1947	vol-91_no-02_Feb-1947_08.jpg	Cameroon				7.370	12.355	Cameroon	In a Freshly Harvested Dress, She Gleans Firewood and Wears It as a Hat	
91	2	Feb	1947	vol-91_no-02_Feb-1947_09.jpg	Cameroon				7.370	12.355	Cameroon	Fali Women Trip the Light Fantastic on Heavy Legs	These ceremonial dancers perform, in their way, the village ballet o1 Bassoum. Some of their steps resemble those of the quadrille. an obsolete square dance, the photographer reports.
													
91	3	March	1947	vol-91_no-03_Mar-1947_01.jpg	Iran	Abadan	Abadan	آبادان	30.367	48.276	Iran	Reza Shah Pahlevi, Deposed Leader of Modern Iran, Gazes at the Splendid University He Created	Located between the old city and the Elburz Mountain wall, the 12-year-old University of Tehran has Schools of Liberal Arts, Medicine, Law, Industry, and Theology. Building were designed by the archeologist André Godard. Near the mountains was Camp Amirabad, headquarters of the U.S.A. Persian Gulf Command. 
91	3	March	1947	vol-91_no-03_Mar-1947_02.jpg	Iran	Abadan	Abadan	آبادان	30.367	48.276	Iran	Old Glory Waved above Camp Amirabad, Headquarters of the Persian Gulf Command	From here, near Tehran, was directed the transport of Lend-Lease material to embattled Russia. Despite desert heat and mountain blizzard, nearly 4,500,000 tons of supplies sped over rutted roads and crowded rails. American troops pulled out of Iran in March, 1946. 
91	3	March	1947	vol-91_no-03_Mar-1947_03.jpg	Iran	Abadan	Abadan	آبادان	30.367	48.276	Iran	Iron Fence in Front of Bank and Post Office Serves as Display Rack for Old Rugs on Sale in Tehran	Oriental rugs have an all-purpose use; they serve as the bedroll and valise, picnic rug, display counter, and shop decoration in Iranian life.
91	3	March	1947	vol-91_no-03_Mar-1947_04.jpg	Iran	Abadan	Abadan	آبادان	30.367	48.276	Iran	Persian Rugs Add Art to Adaban's Shop Fronts	Grocery shops, bakeries, and barbershops hang them at their entrances or lay them flat for customers to sit on. Abadan is hot, muggy, and muddy. 
91	3	March	1947	vol-91_no-03_Mar-1947_05.jpg	Iran	Abadan	Abadan	آبادان	30.367	48.276	Iran	To Guard Against Attacks of Rival Communist Chinese, Nationalists Built Pillboxes in Mukden's Streets	Two city police direct traffic from its roof. Pedicabs, a combination bicycle-ricksha, approach at left. Droshkies and canopied carts serve in lieu of buses. Lacking electricity, no streetcars run.In the right background is an ornamental archway near the old Manchu Forbidden City.
91	3	March	1947	vol-91_no-03_Mar-1947_06.jpg	China	Manchuria	Manchuria		49.360	117.250	China	Treated to Fiery Chinese Whisky and Peanuts, Workmen Celebrate the Reopening of an Oil Plant	Here at Fushun the Japanese had two plants for extracting oil from shale. After weeks of work, the Chinese succeeded in getting part of the older one into operation. Russians stripped the other of so many parts it was useless. A few Japanese technicians were kept to assist the Chinese in reassembling the machinery.
91	3	March	1947	vol-91_no-03_Mar-1947_07.jpg	China	Manchuria	Manchuria		49.360	117.250	China	Triumphant Soviet Forces Raised This Tank-crowned Monument in Mukden	It stands in front of the rengten station ol the old South Manchuria Railway. A similar shait. topped by the replica of an airplane, was erected in Changchun, the capital. THe Soviet Union struck against Japanese forces in Manchuria six days before Japan sued for peace. Much of their occupation took place after the cease-fire order had been issued.
91	3	March	1947	vol-91_no-03_Mar-1947_08.jpg	China	Manchuria	Manchuria		49.360	117.250	China	Coal Diggers Have Hewn a Mighty Stair-stepped Gash in the Earth at Fushun	The huge open-cut mine is more than four miles long and nearly a mile wide. The coal seam is some 400 feet thick at one end and about one-third as deep at the other. Chinese now carry on limited operations and mine about 3,000 tons a day. Overlying the coal is shale, from which the Japanese extracted oil. Beyond the rim rear the oil plants and large electrical power station.
91	3	March	1947	vol-91_no-03_Mar-1947_09.jpg	China	Manchuria	Manchuria		49.360	117.250	China	Mukden's Curb Market Does a Thriving Trade	Street "flea markets" display a bewildering assortment of Japanese kimonos, secondhand clothes, cameras, suitcases, electrical gadgets, and junk. A Japanese woman stands near the center trying to sell some of her possessions. Most merchants are Chinese, as the majority of Japanese had already been evacuated from the city by midsummer, 1946. 
91	3	March	1947	vol-91_no-03_Mar-1947_10.jpg	China	Manchuria	Manchuria		49.360	117.250	China	Capturing Noodles with Chopsticks Requires Concentration!	With food scarce and expensive, little brother is not missing a single slippery morsel. These Chinese youngsters in the Fushun market place, like many grownups, patronize street vendors who carry portable food kitchens on a shoulder pole. Manchuria, normally a land of plenty, now has shortages because of civil strife.
91	3	March	1947	vol-91_no-03_Mar-1947_11.jpg	China	Manchuria	Manchuria		49.360	117.250	China	Symbol on the Gate Shows that Here Was the Palace of Puppet Emperor Kang Te	Brass bosses have been pulled off as high as people can reach. The palace is stripped, its windows broken. Sandbags clutter its terrace. Soviet troops captured the unhappy figurehead when they entered Changchun. Later they took him to Tokyo to testify in war-guilt trials and then flew him back to the U.S.S.R. in September, 1946. The palace was damaged later when rival Chinese groups fought in its courtyards.
91	3	March	1947	vol-91_no-03_Mar-1947_12.jpg	China	Manchuria	Manchuria		49.360	117.250	China	Carrying Fluttering Banners and Flags, Communist Chinese Gather for a Mass Meeting in Harbin	After Soviet troops withdrew in 1946, these forces took over this important city. Harbin was founded a half century ago when Czarist Russia pressed the building of the Chinese Eastern Railway. The bulbous-domed church is a monument of those days. Thousands of White Russians still live in the city. 
													
91	4	April	1947	vol-91_no-04_Apr-1947_01.jpg	Hong Kong	Hong Kong	Hong Kong		22.319	114.169	Hong Kong	A Bearded Lion, Three Men High, Stalks a Hong Kong Holiday Crowd	In the century after it became a British crown colony in 1841, this island near the mouth of Chinas Canton River grew into one of the world's largest ports. Japanese held it from Christmas, 1941, to September 16, 1945. Now Hong Kong is regaining its prewar trade.
91	4	April	1947	vol-91_no-04_Apr-1947_02.jpg	Hong Kong	Hong Kong	Hong Kong		22.319	114.169	Hong Kong	Fishing Boats Jam the Natural Harbor of Cheung Chau, Called "Dumbbell Island" Because of Its Shape	Fishermen live on the narrow neck of land which connects two hilly knobs. This community lies west of Hong Kong Island, but is part of the colony. For nearly two centuries before China ceded Hong Kong, pirates used the region as a base to harass English merchant ships.
91	4	April	1947	vol-91_no-04_Apr-1947_03.jpg	Hong Kong	Hong Kong	Hong Kong		22.319	114.169	Hong Kong	Freed from Japanese Internment, a Hong Kong Official Greets His Liberator	A smile creases the gaunt face of Sir Grenville Alabaster, former Attorney General of the colony, as he talks with Rear Admiral C.H.J. Harcourt, who accepted the Japanese surrender.
91	4	April	1947	vol-91_no-04_Apr-1947_04.jpg	Hong Kong	Hong Kong	Hong Kong		22.319	114.169	Hong Kong	The Long and Short of It: a Chinese Boy Joins a British Sentry on Patrol	Warships led by the new 35,000-ton British battleship Anson relieved Hong Kong. Prisoners of war and internees, including jubilant Canadian troops, rejoiced over the end of suffering. Japanese officers, replacing them in prison, were released to sign the surrender document while 21-gun salutes blazed and fireworks crackled.
91	4	April	1947	vol-91_no-04_Apr-1947_05.jpg	Marshall Islands	Bikini Atoll	Bikini Atoll	Pikinni	11.607	165.377	Marshall Islands	Bikini's First Atomic Bomb Rides at 30,000 Feet in Dave's Dream, a B-29	
91	4	April	1947	vol-91_no-04_Apr-1947_06.jpg	Marshall Islands	Bikini Atoll	Bikini Atoll	Pikinni	11.607	165.377	Marshall Islands	Uranium Explodes with the Power That Lights the Stars. Swift and Silent, Its Mushroom Cloud Rises from Bikini Lagoon	
91	4	April	1947	vol-91_no-04_Apr-1947_07.jpg	Marshall Islands	Bikini Atoll	Bikini Atoll	Pikinni	11.607	165.377	Marshall Islands	An Atomic Volcano Sprays the Target Fleet with Invisible Poison and Sinks Three Capital Ships in One Blow	
													
91	5	May	1947	vol-91_no-05_May-1947_01.jpg	USA	South Dakota	South Dakota		43.970	-99.902	United States	This Striking Mural in the State Capitol at Pierre Portrays South Dakota's Progress	The panel was painted by Edwin H. Blashfield. South Dakota, the central figure, is led forward by Hope, top female figure. Settlers help her conquer the Indians as Evil skulls away. Below is the State flag, designed by Mrs. Ida A. McNeil, of Pierre. On the reverse of the blazing sun appears the State's great seal, in dark blue.
91	5	May	1947	vol-91_no-05_May-1947_02.jpg	USA	South Dakota	South Dakota		43.970	-99.902	United States	The Historic French Name of South Dakota's Capital City Is Spelled P-i-e-r-r-e. but Local Residents Pronounce It "Peer'	Built in 1832 as a trading post by the American Fur Company on the opposite bank of the Missouri. Fort Pierre was sold to the U.S. Government in 1855, for use as an Army post. Here a bevy of girls, who clerk in the Capitol Building in background, eas lunch on the grounds as Canada geese idle in the lake. 
91	5	May	1947	vol-91_no-05_May-1947_03.jpg	USA	South Dakota	South Dakota		43.970	-99.902	United States	Bright-eyed Boys Admire an Indian Chief's Gorgeous	With pipe and drum. Chief Fools Crow has just participated in a Sioux "grass dance" in Custer State Park, named for the cavalry leader who died at the Battle of the Little Bighorn, in Montana. After the dance a buffalo was killed for the Indians' Fourth of July barbecue. To show it was their meat, they tied a knot in its tail.
91	5	May	1947	vol-91_no-05_May-1947_04.jpg	USA	South Dakota	South Dakota		43.970	-99.902	United States	Stern Faces of Washington, Jefferson, Theodore Roosevelt, and Lincoln Gaze from Mount Rushmore in the Black Hills	Gutzon Borglum carved these heads, Washington's face measures 60 feet from chin to forehead; beside it the giant head of Egypt's famous Sphinx would be a pygmy. A man could stand erect in Lincoln's eye. From the air the monument is visible 60 miles away. This picture is deceptive; spectators are many hundreds of feet below the faces. 
91	5	May	1947	vol-91_no-05_May-1947_05.jpg	USA	South Dakota	South Dakota		43.970	-99.902	United States	In This Corn Palace a Hungry Mule Could Literally Eat Himself Out of House and Home!	Built in the thriving city of Mitchell. in the southeastern part of the State, this unique structure is used for fairs, exhibitions, and conventions. It is freshly decorated with ears of corn each fall. Here American Legionnaires parade through this city where corn is king.
91	5	May	1947	vol-91_no-05_May-1947_06.jpg	USA	South Dakota	South Dakota		43.970	-99.902	United States	"Final Exams Tomorrow, so l've Sure Got to Cram!"	On the steps of Coolidge Sylvan Theater at the State College o Agriculture and Mechanic Arts. in Brookings. a puzzled coed bites her pencil-and thinks. Coughlin campanile in the background. Thousands of the State's farm boys and girls have been trained here for useful living.
91	5	May	1947	vol-91_no-05_May-1947_07.jpg	USA	South Dakota	South Dakota		43.970	-99.902	United States	Indian Dolls, Accurate in Every Feature and Detail of Dress	Marjorie Holmquist, Rapid City airline agent, examines this valuable group at Game Lodge, Custer State Park. An Indian artist worked years, carving faces of Crazy Horse, Sitting Bull, Spotted Tail, and other Sioux.
91	5	May	1947	vol-91_no-05_May-1947_08.jpg	USA	South Dakota	South Dakota		43.970	-99.902	United States	"Dakota Woman," Painted by Harvey Dunn, South Dakota Artist, Reflects the Loneliness of Prairie Wheat-farm Lite	Not a tree! Only an old umbrella to shade her infant while she dreams of greener lands back east. Hung at Mitchell, this painting belongs to the Dakota galleries, sponsored by Friends of the Middle Border, an organization devoted to preserving Midwest tradition. 
91	5	May	1947	vol-91_no-05_May-1947_09.jpg	USA	South Dakota	South Dakota		43.970	-99.902	United States	"Can You Pick Out the Patch Your Boy Friend Put on His Shoulder When He Went to War?"	Preserved at the University of South Dakota at Vermillion, this quiltlike collection is made up of insignia worn by students who joined the armed services.
91	5	May	1947	vol-91_no-05_May-1947_10.jpg	USA	South Dakota	South Dakota		43.970	-99.902	United States	Here the Stratosphere Balloon Ascended to Greatest Height Ever Reached by Man	From this natural bowl near Rapid City, the National Geographic-Army Air Forces Explorer II soared aloft on November 11, 1935. Captains Albert W. Stevens and Orvil A. Anderson ascended to 72,395 feet. Left to right, Pilot Anderson (now a Major General), General of the Army H. H. Arnold of the Army Air Forces, and Thomas W. McKnew, Secretary of the National Geographic Society, install a plaque commemorating the ascension. 
91	5	May	1947	vol-91_no-05_May-1947_11.jpg	Colombia	Bogotá	Bogota		4.711	-74.072	Colombia	In Pre-Spanish Days, Chibcha Indians Fashioned Intricate Gold Ornaments	Dwelling in the valleys around present-day Bogotá, they developed an advanced culture nearly equal to that of the Incas. These specimens of their golden headdresses, figurines, and bowls are preserved in the National Museum, in the Banco de la República building in Bogotá. In one ceremony, Chibcha chiefs were powdered with gold dust, which they washed off in a sacred lake.
91	5	May	1947	vol-91_no-05_May-1947_12.jpg	Colombia	Bogotá	Bogota		4.711	-74.072	Colombia	A Señorita Flashes a Smile as Warm as Medellín Sunshine	She comes from the stock of old Spanish families who sought their fortunes in the New World. Colombians are democratic and hospitable. They also are independent. "There are nearly ten million individuals in Colombia," the author was told by a Bogotá hotel proprietor.
91	5	May	1947	vol-91_no-05_May-1947_13.jpg	Colombia	Bogotá	Bogota		4.711	-74.072	Colombia	An Indian Harvest Hand Snips a Bowl of Luncheon Gruel	Descendants of the Indians of the Bogota plateau, he and his fellows raise wheat, potatoes, and corn. When the Spaniards came to COlombia, they put Chibcha farmers to work as serfs on their estates.
91	5	May	1947	vol-91_no-05_May-1947_14.jpg	Colombia	Bogotá	Bogota		4.711	-74.072	Colombia	For Little Fingers, Embroidery Requires Patience and Concentration	These schoolgirls are learning needlework in Bolivar, named for the South American hero. Traveling schools and 600 small libraries supplement COlombia's modern educational program.
91	5	May	1947	vol-91_no-05_May-1947_15.jpg	Colombia	Bogotá	Bogota		4.711	-74.072	Colombia	Admiring Friends Watch a Medellin Artist Paint a Mural of the Americas	Guided by a sketch, Ignacio Gomez Jaramillo fills in the figures of his huge canvas. This popular portrait painter has exhibited his works in New York. In colonial days Colombian artists were inspired by Spanish masters, who usually chose religious themes. Art waned during the 19th-century unrest.
91	5	May	1947	vol-91_no-05_May-1947_16.jpg	Colombia	Bogotá	Bogota		4.711	-74.072	Colombia	Even Steps and Platforms Are Crowded on Wooden Coaches	On the Antioquia railroad a man in a business suit rubs elbows with barefoot countryfolk. One farmer takes home a bouquet of calla lilies. The woman at right wears bobby sox with her sandals. Antioquia Department, of which Medellin is the capital, produces the best coffee and contains COlombia's principal gold mines.
91	5	May	1947	vol-91_no-05_May-1947_17.jpg	Colombia	Bogotá	Bogota		4.711	-74.072	Colombia	"It's My Ball!" Shouts a Soccer Player in Galapa's Village Square	On vacant lots throughout Colombia. Boys enjoy fast games of the national sport in and out of season. The country offers other sports ranging from skiing to hunting jaguars and caymans. Pre-Spanish Indians liked to play turmequé, a game resembling bowling, using flat stone disks.
91	5	May	1947	vol-91_no-05_May-1947_18.jpg	Colombia	Bogotá	Bogota		4.711	-74.072	Colombia	Seven-year-old Girls in White Carry Lilies to Their First Communion	Their sheer dresses and veils follow tradition for this Roman Catholic sacrament. It usually takes place in May when flowers bloom abundantly. Spanish explorers proclaimed Christianity in Colombia in 1509.
91	5	May	1947	vol-91_no-05_May-1947_19.jpg	Colombia	Bogotá	Bogota		4.711	-74.072	Colombia	Gem Experts Appraise Colombian Emeralds, the World's Finest	Riches deposits lie in the Muzo area, about 65 miles north of Bogotá. Indian miners use sharp crowbars and shovels to uncover the green stones. The Colombian Government monopolizes the mining, cutting, and marketing of emeralds. Production has been small in recent years because of the large supply in vaults of the Banco de la República. Emeralds frequently develop flaws after exposure to air. 
													
91	6	June	1947	vol-91_no-06_Jun-1947_01.jpg	USA	Washington	Washington		47.751	-120.740	United States	Seated in His Memorial, Abraham Lincoln Gets White Marble Shoes Shined	Twenty-eight blocks of stone composing the 19-foot figure are joined so truly that all seem as one. Stone-cutters required four years to finish the job. Night lamps endow Lincoln's face with impressive lights and shadows. Yearly some 1,200,000 people visit him. Many mistakenly think he is buried in his Memorial. 
91	6	June	1947	vol-91_no-06_Jun-1947_02.jpg	USA	Washington	Washington		47.751	-120.740	United States	Lincoln in Oils Looks Out into the White House He Knew So Intimately	In the state dining room. which has entertained more than 100 at a time, the small table is set for four. Paneled oak covers the walls. Globes in the silver chandelier shine with a candle effect. Alonzo Fields, who has been with the White House 15 years, polishes silverware. Lincoln's son once owned the portrait.
91	6	June	1947	vol-91_no-06_Jun-1947_03.jpg	USA	Washington	Washington		47.751	-120.740	United States	Peru's Pre-Columbian Ponchos and Amazon's Tropical Buds Are Akin	Some 1,000 years ago a Pacific coast people stitched feathers, obtained in trans-Andean trade into the patterns. Secretary Alexander Wetmore displays a macaw and a parakeet at Smithsonian Institution.
91	6	June	1947	vol-91_no-06_Jun-1947_04.jpg	USA	Washington	Washington		47.751	-120.740	United States	Whenever a President Visits the Capitol. the Sumptuous President's Room Is His	Here the Chief Executive used to sign bills. Lincoln was the hrst to use the table. The glittering chandelier immediately captures the attention of every visitor. Constantino Brumidi executed the frescores: Amerigo Vespucci, Religion, and William Brewster.
91	6	June	1947	vol-91_no-06_Jun-1947_05.jpg	USA	Washington	Washington		47.751	-120.740	United States	A 19-foot Thomas Jefferson Stands on a Pedestal in His Marble Memorial	Owning to the metal shortage in 1943, year of dedication, this statue is of plaster, painted bronze. A 10,000-pound bronze now stands in its place. Wall panels quote Jefferson's philosophy. Says the circular frieze: "I have sworn on the altar of God eternal hostility to every form of tyranny over the mind of man."
91	6	June	1947	vol-91_no-06_Jun-1947_06.jpg	USA	Washington	Washington		47.751	-120.740	United States	Thomas Hopkins Gallaudet Teaches Deaf Alice Cogswell the Manual Alphabet	"Beautiful as a strain of music." the statue stands on Kendall Green. campus of Gallaudet, only college for the deaf. Today, students irom all parts of America are encouraged to read the lips and speak.
91	6	June	1947	vol-91_no-06_Jun-1947_07.jpg	USA	Washington	Washington		47.751	-120.740	United States	Teacher and Children, Visiting Explorers' Hall, National Geographic Society, Examine a Colossal Head from Mexico	Each child taps the head to see if it is solid. It isn't. Carved in lava by a medieval people, the original was too heavy to ship; so a 2,700-pound replica was cast in three sections. Dr. Matthew Stirling, leader of the National Geographic Society-Smithsonian Institution MExican Expeditions, discovered the head at La Venta in 1940. 
91	6	June	1947	vol-91_no-06_Jun-1947_08.jpg	South Korea	Seoul	Seoul	서울	37.552	126.992	South Korea	American and Soviet Commanders in Korea Confer Through an Interpreter	With Lt. Gen. John R. Hodge in his home in Seoul is Soviet Col. Gen. Terenty Shtikov, head of the Soviet delegation to the joint Soviet-American commission intended to arrange the unification of Korea. Conferences, which began in January, 1940, reached a stalemate by May 6 of that year and were adjourned.
91	6	June	1947	vol-91_no-06_Jun-1947_09.jpg	South Korea	Seoul	Seoul	서울	37.552	126.992	South Korea	An Arbitrary Boundary, the 38th Parallel, Splits Korea	The United States XXIV Army Corps. under Lt. Gen. John R. Hodge moved into the area south of that line in September. 1945: a Soviet army occupied the northern zone. Both armies still remain in their respective zones. Koreans await the day when both armies of occupation will depart and their Nation will become reunited and independent. Heijo is the seat of Russian administration.
91	6	June	1947	vol-91_no-06_Jun-1947_10.jpg	South Korea	Seoul	Seoul	서울	37.552	126.992	South Korea	Strong, Well-placed Hands Make Burdens Light	Wherever mother goes, baby goes, too. This country woman carries a basket of cotton along a rocky path from a field near Pusan, Korean port city.
91	6	June	1947	vol-91_no-06_Jun-1947_11.jpg	South Korea	Seoul	Seoul	서울	37.552	126.992	South Korea	"Strike One!" Korean Youngsters Watch a 7th Division Baseball Game in Utchin	Girls entrusted with younger brothers and sisters bring them along pickaback. Americans and American-educated Koreans brought baseball to Korea years ago. American soldiers often play Korean teams. 
													
92	1	July	1947	vol-92_no-01_Jul-1947_01.jpg	USA	Mohawk Valley	Mohawk Valley		42.923	-74.781	United States	From Savages to Girls in Shorts in Less than 200 Years	Like a double exposure of past and present is this scene in the Amsterdam, New York, Post Office. The mural by H. E. Schnakenberg shows Sir William Johnson (1715—1774), Mohawk Valley squire and Superintendent of Indian Affairs, receiving a wampum belt of friendship.
92	1	July	1947	vol-92_no-01_Jul-1947_02.jpg	USA	Mohawk Valley	Mohawk Valley		42.923	-74.781	United States	"Post Two Men Behind Each Tree!" General Herkimer Directing the Battle of Oriskany	When he saw that the Indians would wait for a shot, then rush their man before he could reload, the general ordered his troops to fight in pairs. With blood staining the bandage on his wounded leg, the stouthearted leader sits on his saddle with his back against a beech tree in Frederick C. Yohn's famous painting, reproduced by courtesy of the Utica Public Library. "I will face the enemy," he said. 
92	1	July	1947	vol-92_no-01_Jul-1947_03.jpg	USA	Mohawk Valley	Mohawk Valley		42.923	-74.781	United States	Indians Called This Swimming Hole "Canajoharie"—"The Pot That Washes Itself"	The rhythmical name is borne by the creek and the Mohawk Valley town at its mouth, home of the Beech-Nut Packing COmpany. As if wearied by years, the swirling waters no longer keep the pothole clean, but the silt on the bottom provides added safety for swimming boys.
92	1	July	1947	vol-92_no-01_Jul-1947_04.jpg	USA	Mohawk Valley	Mohawk Valley		42.923	-74.781	United States	Scourge of the Valley Was the War Chief Joseph Brant	Well educated and commissioned an officer by the British. the imperious. resourceful son of a full-blood Mohawk and possibly a part-white mother led the Iroquois in raid after raid upon the bleeding Mohawk Valley during the Revolution. He was known to the Indians as Thayendanegea—"He Places Two Bets Together"—in reference to the custom of fastening together the articles wagered in tribal contests. One of the most remarkable Indians of the 18th century, Brant was feted in England, where this Romney portrait was painted.
