vol,issue,month,year,file_name,country,region,country_db,caption,footnote,,,,,,,,,,,,,,,,,,,,
89,3,March,1946,vol-89_no-03_Mar-1946_06.jpeg,USA,Missouri,United States of America,At Hannibal This Heroic Figure of Mark Twain Overlooks His Beloved Mississippi,"The plaque reads in part: ""Samuel Langhorne Clemens--1935-1910. Mark Twain. His religion was humanity, and a whole world mourned for him when he died."" Raised on the banks of ""Ol' Man River,"" Mark Twain as a michievous boy actually lived much of the life he described in the deeds of Huck Finn and Tom Sawyer.",,,,,,,,,,,,,,,,,,,,
89,3,March,1946,vol-89_no-03_Mar-1946_07.jpeg,USA,Missouri,United States of America,"When St. Louis Children Want to See a Free Circus, All They Have to Do Is Ride Out to the Zoo","Here Director George P. Vierheller demonstrates what wild animals of such contrasting talents and temneraments as big cats, elenhants, and chimpanzees can learn, and how they are taught. Every winter, new tricks are worked out. Methods of training vary, but the keynote is kindness and patience.",,,,,,,,,,,,,,,,,,,,
89,3,March,1946,vol-89_no-03_Mar-1946_08.jpeg,USA,Missouri,United States of America,"The Crowd Doesn't Know Which to Admire Most, Girl or Colt!",Wanda Lou Gooding exhibits Calvin Baxter's prize-winning 5-month-old American saddle colt. Occasion: American Legion's Colt Show at Hamilton race track. The colt was awarded the grant championship of the show.,,,,,,,,,,,,,,,,,,,,
89,3,March,1946,vol-89_no-03_Mar-1946_09.jpeg,Yap,,Federated States of Micronesia,Young Man of Yap Wears Hibiscus Blossoms in His Hair--and Little Else,"This finely proportioned six-footer typifies the men Marines and Seabees found when they landed in the Yap island. Every male adult wore a necklace and metal ornament like a GI ""dog tag."" Japanese army doctors had vaccinated the islanders against disease. Forced to fish for the Japanese, they withheld much of their catch.",,,,,,,,,,,,,,,,,,,,
89,3,March,1946,vol-89_no-03_Mar-1946_10.jpeg,Yap,,Federated States of Micronesia,Yap's Men Have Curly Black Hair and Coffee-colored Skin,"High cheekbones and slightly hooked noses are also typical. Many strains are blended in these people of Micronesia, who were ruled by Spain and Germany before the League of Nations placed the islands under Japanese mandate. Their language Is a mixture of Polvnesian and many other tongues.",,,,,,,,,,,,,,,,,,,,
89,3,March,1946,vol-89_no-03_Mar-1946_11.jpeg,Yap,,Federated States of Micronesia,"Clothing Shortages Mean Nothing to Tenaku, a Yap Belle","She's fully dressed with skirt of shredded coconut leaves, hibiscus and lilies from the near-by jungle for her hair, and neck cord indicating marital status.Tenaku, 26 and the mother of two children, was shot in the left foot by a stray bullet from a plane strafing a Japanese headquarters.",,,,,,,,,,,,,,,,,,,,
89,3,March,1946,vol-89_no-03_Mar-1946_12.jpeg,Yap,,Federated States of Micronesia,Scorpions and Centipedes Often Hide in Yap Women's Skirts,"Weighing as much as 30 pounds, the garments also make comfortable cushions when the wearers sit down. These two matrons stroll along a flagstone path toward the village of Okau. Americans considered Yap women pretty until they smiled and revealed blackened teeth, acquired by staining with herbs and constant chewing of betel.",,,,,,,,,,,,,,,,,,,,
,,,,,,,,,,,,,,,,,,,,,,,,,,,,,
89,4,April,1946,vol-89_no-04_Apr-1946_01.jpeg,England,Cambridge,United Kingdom,"Dr. George M. Trevelyan, Master of Trinity, Reads a Volume of History in His Lode","This distinguished historian administers a college; it teaches undergraduates how to live. They take courses at the University; there Professor Trevelyan lectures to members of all the colleges. Above his fireplace, Trinity's coat of arms shows a lion between the two Bibles. The royal arms (top) represent Henry VIII.",,,,,,,,,,,,,,,,,,,,
89,4,April,1946,vol-89_no-04_Apr-1946_02.jpeg,England,Cambridge,United Kingdom,Antiquity and Modernity Achieve a Pertect Harmony along the Cam. Every Cambridge Graduate Treasures the Memory,"These are the famous Backs, grounds of several riverside colleges. They roughly correspond to an American university's campus. In medieval Cambridge the Cam was bordered by ugly wharves and warehouses; these have disappeared. St. John's New court is framed by willows dipping into the water (Plate IV).",,,,,,,,,,,,,,,,,,,,
89,4,April,1946,vol-89_no-04_Apr-1946_03.jpeg,England,Cambridge,United Kingdom,What a Place for a Holiday Stroll! Across the Cam Go Boys and Girls,"Two Cambridge colleges enroll 500 women a year. Though they attend lectures with the men, girls receive only ""titles to degrees."" Serious students, they are not too great a distraction to the young gentlemen.",,,,,,,,,,,,,,,,,,,,
89,4,April,1946,vol-89_no-04_Apr-1946_04.jpeg,England,Cambridge,United Kingdom,"A Cantabrigian Wears His College's Unmistakable Insignia, a Brilliant Blazer","Blazers got their name from a Cambridge scarlet sports jacket. An athlete's light blue is most coveted. Less arduous sports, such as chess, merit half-blues. Sixth man wears King's College boat Club's blazer.",,,,,,,,,,,,,,,,,,,,
89,4,April,1946,vol-89_no-04_Apr-1946_05.jpeg,England,Cambridge,United Kingdom,Sunday's Loungers Throng the Backs and Watch Punters Poling Past King's Chapel,"Pride of Cambrdre, King's College Chapel is 500 years old. Wordsworth called it ""this immense and glorious work of fine intelligence...where light and shadow repose, where music dwells."" Several GI's stretch on the grass. Tame ducks swim the Cam. Leather is scarce; the punter saves her shoes.",,,,,,,,,,,,,,,,,,,,
89,4,April,1946,vol-89_no-04_Apr-1946_06.jpeg,England,Cambridge,United Kingdom,"Bull Hotel. Given Over to Americans, Inevitably Became ""Bull College."" the GI's Alma Mater","Every fighting Texan who could get to Cambridge made a beeline to the author's rooms for a talk about longhorns and cactus thorns. After the war scores of Tanks took an 8-week course at Army expense. Bull Hotel owes its name to an ancestor, the Black Bull. On the right loom the towers of King's Chapel (Plate XII). ",,,,,,,,,,,,,,,,,,,,
89,4,April,1946,vol-89_no-04_Apr-1946_07.jpeg,India,,India,"Working as a Family in a Mica Mine. Men Dig Ore, Women Carry It on Their Heads","In addition, the wives split the mineral ""books"" into thin sheets, an operation still not done satisfactorily by machinery. This open pit in Bihar illustrates the author's observation about Indias typical mica mine: ""Usually it is braced haphazardly . . . accidents are common."" Rains may start a landslip or flood the shaft (page 503).",,,,,,,,,,,,,,,,,,,,
89,4,April,1946,vol-89_no-04_Apr-1946_08.jpeg,India,,India,These Tall Stalks Provided Jute Fiber for Wartime Sandbags,"Bundles of harvested stalks are soaked in water to loosen the fibers between the surface bark and inner woody sticks. Bales of the cleaned jute then go to Calcutta mills for manufacture into burlap bags, tarpaulins, hessian cloth, and other products. Most of the world's supply is grown on rain-drenched delta lands of the Ganges and Brahmaputra Rivers (page 507).",,,,,,,,,,,,,,,,,,,,
89,4,April,1946,vol-89_no-04_Apr-1946_09.jpeg,India,,India,"Terrace by Terrace, Southern India Miners Shovel Away a River's Banks for Manganese, Steel's Cleansing and Hardening Alloy","On the distant road (center) men walk to work. At the right they have left pillars indicatng the depth of cut. Steam operators stand near a crushing mill's boller, the ore may go by cart up the zigzag trail or flow into barges below. Hand labor in Indian manganese mines has little machine competition, yet it turned out amazing wartime tonnages (page 513).",,,,,,,,,,,,,,,,,,,,
89,4,April,1946,vol-89_no-04_Apr-1946_10.jpeg,India,,India,Cotton Bales Once Destined for Japan Went into War Material for the United Nations,"During the war India wove much of its 7.000.000-bale cotton crop into uniforms, tents, web belts, and numerous other military supplies, Normally. nearly half is available for export. Much of the crop is grown in Black Earth districts of western India, with large processing centers at Bombay and Anmedabad",,,,,,,,,,,,,,,,,,,,
89,4,April,1946,vol-89_no-04_Apr-1946_11.jpeg,India,,India,"Supervised by an American, Indian Workmen Give Airplane Belly Tanks a Final Checkup in Bangalore","The Hindustan Aircraft Company made these supplementary fuel tanks for Allied planes in the China-Burma-India theater. When the extra gas was used up, tanks were dropped. Early in the war, fighter planes were made in this plant; later it became a repair center (page 519).",,,,,,,,,,,,,,,,,,,,
89,4,April,1946,vol-89_no-04_Apr-1946_12.jpeg,India,,India,"India Made Shell and Fuse Gauges, Some Capable of Measuring 1/5000th of an Inch","Inspectors gather in a railroad toolroom. Most of India's rail workshops were converted to the war effort. On one road serving the Burma front, Americans taught native crews to double the tonnage carried (page 522).",,,,,,,,,,,,,,,,,,,,
